2025-12-09 19:59:59,646 - INFO - ================================================================================
2025-12-09 19:59:59,647 - INFO - Starting DDL Execution Script - mktg_ops_tbls_tables
2025-12-09 19:59:59,647 - INFO - Timestamp: 20251209_195959
2025-12-09 19:59:59,647 - INFO - ================================================================================
2025-12-09 19:59:59,647 - INFO - Configuration loaded successfully
2025-12-09 19:59:59,647 - INFO - Log file: D:\fetch_ddl_from_rs\Create_DDL_Output\ddl_logs\mktg_ops_tbls_tables_20251209_195959_log.log
2025-12-09 20:00:03,213 - INFO - Successfully connected to Redshift DEV: redshift.dev.datahub.redcross.net
2025-12-09 20:00:03,220 - INFO - Database: mods_bi, User: hritik_singhania
2025-12-09 20:00:03,234 - INFO - Initialized CSV files with timestamp: 20251209_200003
2025-12-09 20:00:03,234 - INFO -   - Created: D:\fetch_ddl_from_rs\Create_DDL_Output\ddl_output\mktg_ops_tbls_tables_20251209_200003_created.csv
2025-12-09 20:00:03,234 - INFO -   - Errored: D:\fetch_ddl_from_rs\Create_DDL_Output\ddl_output\mktg_ops_tbls_tables_20251209_200003_errored.csv
2025-12-09 20:00:03,245 - INFO - Found 411 SQL files in D:\fetch_ddl_from_rs\Fetch_DDL_Output\ddl_output\mktg_ops_tbls
2025-12-09 20:00:03,245 - INFO - ================================================================================
2025-12-09 20:00:03,245 - INFO - Processing Configuration:
2025-12-09 20:00:03,245 - INFO -   - Schema: mktg_ops_tbls
2025-12-09 20:00:03,245 - INFO -   - Object Type: TABLE
2025-12-09 20:00:03,246 - INFO -   - Total Objects: 411
2025-12-09 20:00:03,246 - INFO -   - Run Identifier: mktg_ops_tbls_tables
2025-12-09 20:00:03,246 - INFO - ================================================================================
2025-12-09 20:00:04,457 - WARNING - \u2717 Failed to create table: adb_accistbl_contacts - Error Type: ALREADY_EXISTS
2025-12-09 20:00:06,110 - INFO - \u2713 Successfully created table: adb_anlytc_hit
2025-12-09 20:00:07,746 - INFO - \u2713 Successfully created table: adb_anlytc_hit_stg
2025-12-09 20:00:09,512 - INFO - \u2713 Successfully created table: adb_anlytc_hit_tgt
2025-12-09 20:00:11,180 - INFO - \u2713 Successfully created table: adb_anlytc_hit_tgt_tst
2025-12-09 20:00:12,971 - INFO - \u2713 Successfully created table: adb_anlytc_hit_tgt_xtrct
2025-12-09 20:00:14,272 - WARNING - \u2717 Failed to create table: adb_arcbitlyreturn - Error Type: ALREADY_EXISTS
2025-12-09 20:00:15,445 - WARNING - \u2717 Failed to create table: adb_arcgms_broadlog - Error Type: ALREADY_EXISTS
2025-12-09 20:00:17,050 - INFO - \u2713 Successfully created table: adb_arcinsms_report_intermediate
2025-12-09 20:00:18,296 - WARNING - \u2717 Failed to create table: adb_arckaleyradeactivation - Error Type: ALREADY_EXISTS
2025-12-09 20:00:19,454 - WARNING - \u2717 Failed to create table: adb_arcprefchangefr - Error Type: ALREADY_EXISTS
2025-12-09 20:00:21,035 - INFO - \u2713 Successfully created table: adb_arcregionchaptermapping
2025-12-09 20:00:22,334 - WARNING - \u2717 Failed to create table: adb_arcreportcellcode - Error Type: ALREADY_EXISTS
2025-12-09 20:00:23,562 - WARNING - \u2717 Failed to create table: adb_arctreatmentcode - Error Type: ALREADY_EXISTS
2025-12-09 20:00:25,215 - INFO - \u2713 Successfully created table: adb_bio_dnr_stsfctn_srvy
2025-12-09 20:00:26,992 - INFO - \u2713 Successfully created table: adb_enumrtn_lkp
2025-12-09 20:00:28,177 - WARNING - \u2717 Failed to create table: adb_nmsaddress - Error Type: ALREADY_EXISTS
2025-12-09 20:00:29,365 - WARNING - \u2717 Failed to create table: adb_nmsbroadlogmsg - Error Type: ALREADY_EXISTS
2025-12-09 20:00:30,552 - WARNING - \u2717 Failed to create table: adb_nmsbroadlogrcp - Error Type: ALREADY_EXISTS
2025-12-09 20:00:31,808 - WARNING - \u2717 Failed to create table: adb_nmsdelivery - Error Type: ALREADY_EXISTS
2025-12-09 20:00:33,132 - WARNING - \u2717 Failed to create table: adb_nmsexcludelogrcp - Error Type: ALREADY_EXISTS
2025-12-09 20:00:34,308 - WARNING - \u2717 Failed to create table: adb_nmsinsms - Error Type: ALREADY_EXISTS
2025-12-09 20:00:35,502 - WARNING - \u2717 Failed to create table: adb_nmsoperation - Error Type: ALREADY_EXISTS
2025-12-09 20:00:37,109 - INFO - \u2713 Successfully created table: adb_nmspropositionrcp
2025-12-09 20:00:38,687 - WARNING - \u2717 Failed to create table: adb_nmsrecipient - Error Type: ALREADY_EXISTS
2025-12-09 20:00:39,895 - WARNING - \u2717 Failed to create table: adb_nmsservice - Error Type: ALREADY_EXISTS
2025-12-09 20:00:41,113 - WARNING - \u2717 Failed to create table: adb_nmssubscription - Error Type: ALREADY_EXISTS
2025-12-09 20:00:42,280 - WARNING - \u2717 Failed to create table: adb_nmstrackinglogrcp - Error Type: ALREADY_EXISTS
2025-12-09 20:00:43,467 - WARNING - \u2717 Failed to create table: adb_nmstrackingurl - Error Type: ALREADY_EXISTS
2025-12-09 20:00:44,642 - WARNING - \u2717 Failed to create table: adb_nmsuseragent - Error Type: ALREADY_EXISTS
2025-12-09 20:00:46,027 - WARNING - \u2717 Failed to create table: adb_nmswebapp - Error Type: ALREADY_EXISTS
2025-12-09 20:00:47,222 - WARNING - \u2717 Failed to create table: adb_nmswebapplogrcp - Error Type: ALREADY_EXISTS
2025-12-09 20:00:48,435 - WARNING - \u2717 Failed to create table: adb_nmswebapplogrcpdata - Error Type: ALREADY_EXISTS
2025-12-09 20:00:50,028 - INFO - \u2713 Successfully created table: adb_vlntr_srvy_rspns
2025-12-09 20:00:51,635 - INFO - \u2713 Successfully created table: adb_vlntr_srvy_rspns_tmp
2025-12-09 20:00:53,222 - INFO - \u2713 Successfully created table: adb_vlntr_srvy_rspns_v20
2025-12-09 20:00:54,481 - WARNING - \u2717 Failed to create table: adb_xtkfolder - Error Type: ALREADY_EXISTS
2025-12-09 20:00:55,842 - WARNING - \u2717 Failed to create table: adb_xtkworkflow - Error Type: ALREADY_EXISTS
2025-12-09 20:00:57,429 - INFO - \u2713 Successfully created table: adobe_analytics_txn
2025-12-09 20:00:58,977 - INFO - \u2713 Successfully created table: adobe_analytics_visits
2025-12-09 20:01:00,658 - INFO - \u2713 Successfully created table: adobe_dwb_intrctn
2025-12-09 20:01:02,428 - INFO - \u2713 Successfully created table: adobe_dwb_intrctn_bkp
2025-12-09 20:01:03,994 - INFO - \u2713 Successfully created table: adobe_dwb_intrctn_stg
2025-12-09 20:01:05,593 - INFO - \u2713 Successfully created table: adobe_dwb_intrctn_stg_tmp
2025-12-09 20:01:07,284 - INFO - \u2713 Successfully created table: adobe_dwb_txn
2025-12-09 20:01:08,908 - INFO - \u2713 Successfully created table: adobe_dwb_txn_bkp
2025-12-09 20:01:10,559 - INFO - \u2713 Successfully created table: adobe_dwb_txn_stg
2025-12-09 20:01:12,257 - INFO - \u2713 Successfully created table: agent
2025-12-09 20:01:14,230 - INFO - \u2713 Successfully created table: all_aem_rco_rows
2025-12-09 20:01:14,235 - INFO - Progress: 50/411 tables processed
2025-12-09 20:01:15,437 - WARNING - \u2717 Failed to create table: aprm_arc_comm_log - Error Type: ALREADY_EXISTS
2025-12-09 20:01:16,717 - WARNING - \u2717 Failed to create table: aprm_audmem_map - Error Type: ALREADY_EXISTS
2025-12-09 20:01:17,891 - WARNING - \u2717 Failed to create table: aprm_bncd_eml_img - Error Type: ALREADY_EXISTS
2025-12-09 20:01:19,074 - WARNING - \u2717 Failed to create table: aprm_dim_activity - Error Type: ALREADY_EXISTS
2025-12-09 20:01:20,325 - WARNING - \u2717 Failed to create table: aprm_email_bncd - Error Type: ALREADY_EXISTS
2025-12-09 20:01:21,497 - WARNING - \u2717 Failed to create table: aprm_email_lnk_clkd - Error Type: ALREADY_EXISTS
2025-12-09 20:01:22,703 - WARNING - \u2717 Failed to create table: aprm_email_lnk_clkd_img - Error Type: ALREADY_EXISTS
2025-12-09 20:01:23,875 - WARNING - \u2717 Failed to create table: aprm_email_opened - Error Type: ALREADY_EXISTS
2025-12-09 20:01:25,266 - WARNING - \u2717 Failed to create table: aprm_email_opened_img - Error Type: ALREADY_EXISTS
2025-12-09 20:01:26,617 - WARNING - \u2717 Failed to create table: aprm_email_remove - Error Type: ALREADY_EXISTS
2025-12-09 20:01:28,058 - WARNING - \u2717 Failed to create table: aprm_email_remove_img - Error Type: ALREADY_EXISTS
2025-12-09 20:01:29,318 - WARNING - \u2717 Failed to create table: aprm_email_sent - Error Type: ALREADY_EXISTS
2025-12-09 20:01:30,528 - WARNING - \u2717 Failed to create table: aprm_email_sent_img - Error Type: ALREADY_EXISTS
2025-12-09 20:01:32,220 - WARNING - \u2717 Failed to create table: aprm_msg_cnt_blk_img - Error Type: ALREADY_EXISTS
2025-12-09 20:01:33,393 - WARNING - \u2717 Failed to create table: aprm_msg_content_block - Error Type: ALREADY_EXISTS
2025-12-09 20:01:35,095 - WARNING - \u2717 Failed to create table: aprm_wb_apnd_bio_dnr_stsfctn_srvy - Error Type: ALREADY_EXISTS
2025-12-09 20:01:36,304 - WARNING - \u2717 Failed to create table: aprm_wb_apnd_bncd_eml - Error Type: ALREADY_EXISTS
2025-12-09 20:01:37,573 - WARNING - \u2717 Failed to create table: aprm_wb_apnd_cell_cds - Error Type: ALREADY_EXISTS
2025-12-09 20:01:40,499 - WARNING - \u2717 Failed to create table: aprm_wb_apnd_cm_segmnt - Error Type: ALREADY_EXISTS
2025-12-09 20:01:41,756 - WARNING - \u2717 Failed to create table: aprm_wb_apnd_email - Error Type: ALREADY_EXISTS
2025-12-09 20:01:43,100 - WARNING - \u2717 Failed to create table: aprm_wb_apnd_eml_trckng - Error Type: ALREADY_EXISTS
2025-12-09 20:01:44,719 - INFO - \u2713 Successfully created table: aprm_wb_apnd_eml_trckng_bkp
2025-12-09 20:01:46,193 - WARNING - \u2717 Failed to create table: aprm_wb_apnd_inbnd_frm_cmpltd - Error Type: ALREADY_EXISTS
2025-12-09 20:01:47,533 - WARNING - \u2717 Failed to create table: aprm_wb_apnd_mcrst_mtrcs - Error Type: ALREADY_EXISTS
2025-12-09 20:01:48,831 - WARNING - \u2717 Failed to create table: aprm_wb_apnd_outbnd_msgs - Error Type: ALREADY_EXISTS
2025-12-09 20:01:50,157 - WARNING - \u2717 Failed to create table: aprm_wb_apnd_outbnd_msg_snt - Error Type: ALREADY_EXISTS
2025-12-09 20:01:51,392 - WARNING - \u2717 Failed to create table: aprm_wb_apnd_prfrnc_cntr - Error Type: ALREADY_EXISTS
2025-12-09 20:01:54,190 - WARNING - \u2717 Failed to create table: aprm_wb_apnd_rmv_frm_lst - Error Type: ALREADY_EXISTS
2025-12-09 20:01:55,863 - WARNING - \u2717 Failed to create table: aprm_wb_apnd_segmntn - Error Type: ALREADY_EXISTS
2025-12-09 20:01:57,102 - WARNING - \u2717 Failed to create table: aprm_wb_apnd_treatmnts - Error Type: ALREADY_EXISTS
2025-12-09 20:01:58,353 - WARNING - \u2717 Failed to create table: aprm_wb_apnd_unsubs_rplc - Error Type: ALREADY_EXISTS
2025-12-09 20:01:59,571 - WARNING - \u2717 Failed to create table: aprm_wb_replc_activities - Error Type: ALREADY_EXISTS
2025-12-09 20:02:00,886 - WARNING - \u2717 Failed to create table: aprm_wb_replc_act_cells - Error Type: ALREADY_EXISTS
2025-12-09 20:02:02,135 - WARNING - \u2717 Failed to create table: aprm_wb_replc_act_offrs - Error Type: ALREADY_EXISTS
2025-12-09 20:02:03,508 - WARNING - \u2717 Failed to create table: aprm_wb_replc_act_trtmts - Error Type: ALREADY_EXISTS
2025-12-09 20:02:05,112 - WARNING - \u2717 Failed to create table: aprm_wb_replc_offrs - Error Type: ALREADY_EXISTS
2025-12-09 20:02:07,501 - WARNING - \u2717 Failed to create table: aprm_wb_rplc_fr_prf_cntr_lt - Error Type: ALREADY_EXISTS
2025-12-09 20:02:08,772 - WARNING - \u2717 Failed to create table: aprm_wb_rplc_outbnd_msg_snt - Error Type: ALREADY_EXISTS
2025-12-09 20:02:12,827 - INFO - \u2713 Successfully created table: arc_aem_rco_txn
2025-12-09 20:02:14,243 - WARNING - \u2717 Failed to create table: arc_biomed_smry - Error Type: ALREADY_EXISTS
2025-12-09 20:02:15,940 - INFO - \u2713 Successfully created table: arc_biomed_smry_bkp
2025-12-09 20:02:17,359 - WARNING - \u2717 Failed to create table: arc_biomed_txn - Error Type: ALREADY_EXISTS
2025-12-09 20:02:19,117 - INFO - \u2713 Successfully created table: arc_biomed_txn_bkp
2025-12-09 20:02:20,781 - INFO - \u2713 Successfully created table: arc_biomed_txn_ext_staff
2025-12-09 20:02:22,608 - INFO - \u2713 Successfully created table: arc_biomed_txn_ext_staff_bkp
2025-12-09 20:02:24,336 - INFO - \u2713 Successfully created table: arc_cdi_smry_addr_tmp
2025-12-09 20:02:25,897 - INFO - \u2713 Successfully created table: arc_cdi_smry_email_tmp
2025-12-09 20:02:27,611 - INFO - \u2713 Successfully created table: arc_cdi_smry_extrct
2025-12-09 20:02:29,409 - INFO - \u2713 Successfully created table: arc_cdi_smry_phn_tmp
2025-12-09 20:02:31,004 - INFO - \u2713 Successfully created table: arc_crm_ent_infrd_prfl
2025-12-09 20:02:31,009 - INFO - Progress: 100/411 tables processed
2025-12-09 20:02:32,722 - INFO - \u2713 Successfully created table: arc_crm_ent_prfl
2025-12-09 20:02:34,378 - INFO - \u2713 Successfully created table: arc_fr_smry_extrct
2025-12-09 20:02:36,070 - INFO - \u2713 Successfully created table: arc_fr_smry_extrct_tmp
2025-12-09 20:02:37,968 - INFO - \u2713 Successfully created table: arc_fr_smry_mdl
2025-12-09 20:02:39,586 - INFO - \u2713 Successfully created table: arc_fr_txn_all_cnst
2025-12-09 20:02:41,536 - INFO - \u2713 Successfully created table: arc_fr_txn_bkp
2025-12-09 20:02:43,087 - INFO - \u2713 Successfully created table: arc_fr_txn_bnchmrk_extrct
2025-12-09 20:02:44,930 - INFO - \u2713 Successfully created table: arc_fr_txn_del
2025-12-09 20:02:46,484 - INFO - \u2713 Successfully created table: arc_fr_txn_extrct
2025-12-09 20:02:48,054 - INFO - \u2713 Successfully created table: arc_fr_txn_tst
2025-12-09 20:02:49,749 - INFO - \u2713 Successfully created table: arc_fundrsng_summary
2025-12-09 20:02:51,442 - INFO - \u2713 Successfully created table: arc_glossary
2025-12-09 20:02:53,162 - INFO - \u2713 Successfully created table: arc_lob_smry_extrct
2025-12-09 20:02:55,058 - INFO - \u2713 Successfully created table: arc_lob_smry_extrct_oct
2025-12-09 20:02:56,635 - INFO - \u2713 Successfully created table: arc_lob_smry_non_fr_extrct
2025-12-09 20:02:58,204 - INFO - \u2713 Successfully created table: arc_missing_script_numbers
2025-12-09 20:02:59,983 - INFO - \u2713 Successfully created table: arc_phss_recert_txn
2025-12-09 20:03:01,701 - INFO - \u2713 Successfully created table: arc_phss_recert_txn_bkp
2025-12-09 20:03:03,462 - INFO - \u2713 Successfully created table: arc_phss_smry
2025-12-09 20:03:05,289 - INFO - \u2713 Successfully created table: arc_phss_smry_bkp
2025-12-09 20:03:06,931 - INFO - \u2713 Successfully created table: arc_phss_txn
2025-12-09 20:03:08,480 - INFO - \u2713 Successfully created table: arc_phss_txn_bkp
2025-12-09 20:03:10,278 - INFO - \u2713 Successfully created table: arc_simio_rfm_assets_appends
2025-12-09 20:03:11,964 - INFO - \u2713 Successfully created table: arc_tag_extrct_bridge
2025-12-09 20:03:13,622 - INFO - \u2713 Successfully created table: arc_tag_extrct_bridge_bkp
2025-12-09 20:03:15,139 - INFO - \u2713 Successfully created table: arc_tag_non_fr_extrct_bridge
2025-12-09 20:03:16,756 - INFO - \u2713 Successfully created table: arc_tag_non_fr_extrct_bridge_bkp
2025-12-09 20:03:18,446 - INFO - \u2713 Successfully created table: arc_tag_non_fr_extrct_bridge_tmp
2025-12-09 20:03:20,034 - INFO - \u2713 Successfully created table: arc_vms_smry
2025-12-09 20:03:21,814 - INFO - \u2713 Successfully created table: arc_vms_txn
2025-12-09 20:03:23,562 - INFO - \u2713 Successfully created table: area_code_2_time_zone
2025-12-09 20:03:24,757 - WARNING - \u2717 Failed to create table: audit_log - Error Type: ALREADY_EXISTS
2025-12-09 20:03:26,546 - INFO - \u2713 Successfully created table: awb_cdi_mstr_mrg
2025-12-09 20:03:28,120 - INFO - \u2713 Successfully created table: awb_dmail_xtrct
2025-12-09 20:03:29,979 - INFO - \u2713 Successfully created table: awb_dntn_xtrct
2025-12-09 20:03:31,495 - INFO - \u2713 Successfully created table: awb_rcpnt_2_cdi_mstr
2025-12-09 20:03:33,082 - INFO - \u2713 Successfully created table: awb_rcpnt_2_cdi_mstr_xtrct
2025-12-09 20:03:34,268 - WARNING - \u2717 Failed to create table: bio_dnr_srvy_donat_key_map - Error Type: ALREADY_EXISTS
2025-12-09 20:03:35,840 - INFO - \u2713 Successfully created table: bzfc_active_cnst_multi_snpsht
2025-12-09 20:03:37,412 - INFO - \u2713 Successfully created table: bzfc_active_cnst_segmnt
2025-12-09 20:03:39,601 - INFO - \u2713 Successfully created table: bzfc_active_cnst_snpsht
2025-12-09 20:03:41,581 - INFO - \u2713 Successfully created table: bzfc_adb_recipient_insrt_delta
2025-12-09 20:03:43,253 - INFO - \u2713 Successfully created table: bzfc_adb_recipient_updt_delta
2025-12-09 20:03:44,922 - INFO - \u2713 Successfully created table: bzfc_bio_dnr_segment_dashbrd
2025-12-09 20:03:46,667 - INFO - \u2713 Successfully created table: bzfc_cnst_cdi_phss_email_prfl
2025-12-09 20:03:48,189 - INFO - \u2713 Successfully created table: bzfc_cnst_fr_prfr_em_prfl
2025-12-09 20:03:49,955 - INFO - \u2713 Successfully created table: bzfc_fact_dmail_interaction
2025-12-09 20:03:51,128 - WARNING - \u2717 Failed to create table: bzfc_fact_dmail_intrctn_norm - Error Type: OTHER_ERROR
2025-12-09 20:03:52,788 - INFO - \u2713 Successfully created table: bzfc_fact_donation
2025-12-09 20:03:54,357 - INFO - \u2713 Successfully created table: bzfc_fact_interaction
2025-12-09 20:03:54,366 - INFO - Progress: 150/411 tables processed
2025-12-09 20:03:56,003 - INFO - \u2713 Successfully created table: bzfc_fact_interaction_all
2025-12-09 20:03:57,675 - INFO - \u2713 Successfully created table: bzfc_fact_intrctn_em_smry
2025-12-09 20:03:59,345 - INFO - \u2713 Successfully created table: bzfc_fact_phone_interaction
2025-12-09 20:04:00,917 - INFO - \u2713 Successfully created table: bzfc_fact_response_all
2025-12-09 20:04:02,631 - INFO - \u2713 Successfully created table: bzfc_fact_response_new
2025-12-09 20:04:03,822 - WARNING - \u2717 Failed to create table: bzfc_fact_surv_resp - Error Type: ALREADY_EXISTS
2025-12-09 20:04:05,436 - INFO - \u2713 Successfully created table: bzfc_pg_response_log
2025-12-09 20:04:07,077 - INFO - \u2713 Successfully created table: bzfc_pg_response_log_ref
2025-12-09 20:04:08,600 - INFO - \u2713 Successfully created table: bzfc_phss_lrnr_list_membrshp
2025-12-09 20:04:10,303 - INFO - \u2713 Successfully created table: bzfc_sms_fr_prfl
2025-12-09 20:04:11,920 - INFO - \u2713 Successfully created table: bzfc_sms_profile
2025-12-09 20:04:13,617 - INFO - \u2713 Successfully created table: bzfc_sponsor_journey_detail
2025-12-09 20:04:15,239 - INFO - \u2713 Successfully created table: bzfc_sponsor_journey_smry
2025-12-09 20:04:17,092 - INFO - \u2713 Successfully created table: bzf_cem_cnst_opt_outs_copy
2025-12-09 20:04:18,600 - INFO - \u2713 Successfully created table: bzf_cem_cnst_opt_outs_stg
2025-12-09 20:04:19,777 - WARNING - \u2717 Failed to create table: bzf_cnst_cdi_sltn_id - Error Type: ALREADY_EXISTS
2025-12-09 20:04:21,466 - INFO - \u2713 Successfully created table: bzf_cnst_cdi_sltn_id_1
2025-12-09 20:04:23,142 - INFO - \u2713 Successfully created table: bzf_cnst_cdi_sltn_id_2
2025-12-09 20:04:24,820 - INFO - \u2713 Successfully created table: bzf_cnst_cdi_sltn_id_3
2025-12-09 20:04:26,469 - INFO - \u2713 Successfully created table: bzf_cnst_cdi_sltn_id_4
2025-12-09 20:04:28,151 - INFO - \u2713 Successfully created table: bzf_cnst_cdi_sltn_id_5
2025-12-09 20:04:29,795 - INFO - \u2713 Successfully created table: bzf_cnst_cdi_sltn_id_all
2025-12-09 20:04:31,406 - INFO - \u2713 Successfully created table: bzf_cnst_cdi_sltn_id_bk
2025-12-09 20:04:32,758 - WARNING - \u2717 Failed to create table: bzf_cnst_chrctrstc_simio - Error Type: ALREADY_EXISTS
2025-12-09 20:04:34,393 - INFO - \u2713 Successfully created table: bzf_cnst_scr
2025-12-09 20:04:35,860 - WARNING - \u2717 Failed to create table: bzf_cnst_scr_simio - Error Type: ALREADY_EXISTS
2025-12-09 20:04:37,053 - WARNING - \u2717 Failed to create table: bzl_cnst_fsa_acqstn - Error Type: ALREADY_EXISTS
2025-12-09 20:04:38,250 - WARNING - \u2717 Failed to create table: bzl_cnst_mstr_fsa_in_primary - Error Type: ALREADY_EXISTS
2025-12-09 20:04:39,795 - INFO - \u2713 Successfully created table: bz_adobe_analytics_rcb_txn
2025-12-09 20:04:41,419 - INFO - \u2713 Successfully created table: bz_adobe_analytics_rco_txn
2025-12-09 20:04:43,087 - INFO - \u2713 Successfully created table: bz_adobe_analytics_ts_txn
2025-12-09 20:04:44,754 - INFO - \u2713 Successfully created table: bz_arcpg_response_typ
2025-12-09 20:04:46,280 - INFO - \u2713 Successfully created table: bz_arc_fr_smry_atg_first_tm
2025-12-09 20:04:47,867 - INFO - \u2713 Successfully created table: bz_arc_fr_smry_rco_first_tm
2025-12-09 20:04:49,427 - INFO - \u2713 Successfully created table: bz_arc_fr_smry_rco_last_donat
2025-12-09 20:04:51,095 - INFO - \u2713 Successfully created table: bz_arc_fr_smry_rco_last_sustnr_donat
2025-12-09 20:04:52,893 - INFO - \u2713 Successfully created table: bz_cnst_birth_best
2025-12-09 20:04:54,496 - INFO - \u2713 Successfully created table: bz_cnst_gender_best
2025-12-09 20:04:56,058 - INFO - \u2713 Successfully created table: bz_cur_mth_bio_donor_freq
2025-12-09 20:04:57,814 - INFO - \u2713 Successfully created table: bz_cur_mth_bio_donor_freq2
2025-12-09 20:04:59,752 - INFO - \u2713 Successfully created table: bz_dim_cnst_demographic
2025-12-09 20:05:01,507 - INFO - \u2713 Successfully created table: bz_dim_rpt_cell_cd
2025-12-09 20:05:03,072 - INFO - \u2713 Successfully created table: bz_dim_treatmnt
2025-12-09 20:05:04,625 - INFO - \u2713 Successfully created table: bz_email_src_cd
2025-12-09 20:05:06,292 - INFO - \u2713 Successfully created table: bz_fact_interaction_pg
2025-12-09 20:05:07,949 - INFO - \u2713 Successfully created table: bz_fact_response_pg
2025-12-09 20:05:09,677 - INFO - \u2713 Successfully created table: bz_gms_arc_fr_txn_segmnt
2025-12-09 20:05:11,246 - INFO - \u2713 Successfully created table: bz_google_analytics_txn
2025-12-09 20:05:12,844 - INFO - \u2713 Successfully created table: bz_pg_group_membrshp
2025-12-09 20:05:14,451 - INFO - \u2713 Successfully created table: campgn_prospct_list
2025-12-09 20:05:14,463 - INFO - Progress: 200/411 tables processed
2025-12-09 20:05:15,655 - WARNING - \u2717 Failed to create table: campgn_yr_end_dow_projctn - Error Type: ALREADY_EXISTS
2025-12-09 20:05:17,207 - INFO - \u2713 Successfully created table: chptr_list_membrshp
2025-12-09 20:05:18,769 - INFO - \u2713 Successfully created table: chptr_portal_list_typ_ref
2025-12-09 20:05:20,334 - INFO - \u2713 Successfully created table: cnst_addr_ncoa_log
2025-12-09 20:05:21,523 - WARNING - \u2717 Failed to create table: cnst_cdi_bio_preferred_dmail - Error Type: ALREADY_EXISTS
2025-12-09 20:05:22,704 - WARNING - \u2717 Failed to create table: cnst_cdi_bio_preferred_email - Error Type: ALREADY_EXISTS
2025-12-09 20:05:24,041 - WARNING - \u2717 Failed to create table: cnst_cdi_phss_preferred_dmail - Error Type: ALREADY_EXISTS
2025-12-09 20:05:25,217 - WARNING - \u2717 Failed to create table: cnst_cdi_phss_preferred_email - Error Type: ALREADY_EXISTS
2025-12-09 20:05:26,410 - WARNING - \u2717 Failed to create table: cnst_cdi_smry_bio_prfr - Error Type: ALREADY_EXISTS
2025-12-09 20:05:27,951 - INFO - \u2713 Successfully created table: cnst_cdi_smry_non_fr_prfr
2025-12-09 20:05:29,523 - INFO - \u2713 Successfully created table: cnst_cdi_smry_phss_prfr
2025-12-09 20:05:31,072 - INFO - \u2713 Successfully created table: cnst_cdi_smry_phss_prfr_stg
2025-12-09 20:05:32,650 - INFO - \u2713 Successfully created table: cnst_cdi_smry_vms_prfr
2025-12-09 20:05:34,269 - INFO - \u2713 Successfully created table: cnst_cdi_smry_vms_prfr_stg
2025-12-09 20:05:35,507 - WARNING - \u2717 Failed to create table: cnst_cdi_s_f_p_fr_dmail - Error Type: ALREADY_EXISTS
2025-12-09 20:05:37,048 - WARNING - \u2717 Failed to create table: cnst_cdi_s_f_p_fr_email - Error Type: ALREADY_EXISTS
2025-12-09 20:05:38,588 - INFO - \u2713 Successfully created table: cnst_cdi_vms_preferred_dmail
2025-12-09 20:05:40,138 - INFO - \u2713 Successfully created table: cnst_cdi_vms_preferred_email
2025-12-09 20:05:41,867 - INFO - \u2713 Successfully created table: cnst_scr_acct
2025-12-09 20:05:43,422 - INFO - \u2713 Successfully created table: cnvo_reactivation_list
2025-12-09 20:05:44,990 - INFO - \u2713 Successfully created table: dim_bio_donat_freq
2025-12-09 20:05:46,163 - WARNING - \u2717 Failed to create table: dim_bio_mstr_cust_appnd - Error Type: ALREADY_EXISTS
2025-12-09 20:05:47,375 - WARNING - \u2717 Failed to create table: dim_bio_product - Error Type: SYNTAX_ERROR
2025-12-09 20:05:48,813 - WARNING - \u2717 Failed to create table: dim_campgn - Error Type: ALREADY_EXISTS
2025-12-09 20:05:50,153 - WARNING - \u2717 Failed to create table: dim_delivery - Error Type: ALREADY_EXISTS
2025-12-09 20:05:51,937 - INFO - \u2713 Successfully created table: dim_dm_src_treatmnt_xref
2025-12-09 20:05:53,502 - INFO - \u2713 Successfully created table: dim_edrtl_response_period
2025-12-09 20:05:55,022 - INFO - \u2713 Successfully created table: dim_email_segmnt
2025-12-09 20:05:56,538 - INFO - \u2713 Successfully created table: dim_odr
2025-12-09 20:05:58,079 - INFO - \u2713 Successfully created table: dim_online_channel
2025-12-09 20:05:59,611 - INFO - \u2713 Successfully created table: dim_phone_adtnl_reqst
2025-12-09 20:06:01,195 - INFO - \u2713 Successfully created table: dim_phone_call_dspstn
2025-12-09 20:06:02,660 - WARNING - \u2717 Failed to create table: dim_phone_campgn - Error Type: ALREADY_EXISTS
2025-12-09 20:06:03,838 - WARNING - \u2717 Failed to create table: dim_phone_campgn_bkp - Error Type: ALREADY_EXISTS
2025-12-09 20:06:05,431 - INFO - \u2713 Successfully created table: dim_phone_campgn_src_cd_xref
2025-12-09 20:06:06,720 - WARNING - \u2717 Failed to create table: dim_phone_script - Error Type: ALREADY_EXISTS
2025-12-09 20:06:07,999 - WARNING - \u2717 Failed to create table: dim_recipient - Error Type: ALREADY_EXISTS
2025-12-09 20:06:09,910 - INFO - \u2713 Successfully created table: dim_region_rsmo
2025-12-09 20:06:11,494 - INFO - \u2713 Successfully created table: dim_src_2_intrctn_brdg
2025-12-09 20:06:12,708 - WARNING - \u2717 Failed to create table: dim_treatmnt - Error Type: ALREADY_EXISTS
2025-12-09 20:06:13,882 - WARNING - \u2717 Failed to create table: dim_unit_military_station_zips - Error Type: ALREADY_EXISTS
2025-12-09 20:06:15,085 - WARNING - \u2717 Failed to create table: dim_vol_inactvtn_rsn_cd - Error Type: ALREADY_EXISTS
2025-12-09 20:06:17,003 - INFO - \u2713 Successfully created table: dm_campaign_hist
2025-12-09 20:06:19,102 - INFO - \u2713 Successfully created table: dm_campaign_pg_hist
2025-12-09 20:06:20,894 - INFO - \u2713 Successfully created table: dv_active_segmnt_snapsht
2025-12-09 20:06:22,898 - INFO - \u2713 Successfully created table: dv_arc_bio_smry
2025-12-09 20:06:25,427 - INFO - \u2713 Successfully created table: dv_arc_entrprs_smry
2025-12-09 20:06:27,035 - INFO - \u2713 Successfully created table: dv_arc_fr_smry
2025-12-09 20:06:28,720 - INFO - \u2713 Successfully created table: dv_arc_phss_smry
2025-12-09 20:06:30,324 - INFO - \u2713 Successfully created table: dv_arc_vms_smry
2025-12-09 20:06:30,329 - INFO - Progress: 250/411 tables processed
2025-12-09 20:06:31,533 - WARNING - \u2717 Failed to create table: dv_channel_accessibility - Error Type: OTHER_ERROR
2025-12-09 20:06:33,264 - INFO - \u2713 Successfully created table: dv_channel_accessibility_1
2025-12-09 20:06:34,764 - INFO - \u2713 Successfully created table: dv_channel_accessibility_stg
2025-12-09 20:06:36,387 - INFO - \u2713 Successfully created table: dv_de_accessblty_lifestg
2025-12-09 20:06:37,549 - WARNING - \u2717 Failed to create table: dv_de_accessblty_overall - Error Type: OTHER_ERROR
2025-12-09 20:06:39,400 - INFO - \u2713 Successfully created table: dv_de_scorcrd_campgns
2025-12-09 20:06:40,989 - INFO - \u2713 Successfully created table: dv_digtl_engmnt_scorcrd
2025-12-09 20:06:42,636 - INFO - \u2713 Successfully created table: email_src_cd
2025-12-09 20:06:44,659 - INFO - \u2713 Successfully created table: esri_blockgroup_demgrphc
2025-12-09 20:06:46,247 - INFO - \u2713 Successfully created table: esri_zip_cd_demgrphc
2025-12-09 20:06:47,433 - WARNING - \u2717 Failed to create table: fact_dmail_interaction - Error Type: ALREADY_EXISTS
2025-12-09 20:06:48,632 - WARNING - \u2717 Failed to create table: fact_dmail_interaction_bkp - Error Type: OTHER_ERROR
2025-12-09 20:06:49,981 - WARNING - \u2717 Failed to create table: fact_email_interaction - Error Type: ALREADY_EXISTS
2025-12-09 20:06:51,240 - WARNING - \u2717 Failed to create table: fact_interaction_aprm - Error Type: ALREADY_EXISTS
2025-12-09 20:06:53,153 - INFO - \u2713 Successfully created table: fact_interaction_bb
2025-12-09 20:06:54,398 - WARNING - \u2717 Failed to create table: fact_interaction_ff - Error Type: ALREADY_EXISTS
2025-12-09 20:06:55,971 - INFO - \u2713 Successfully created table: fact_phone_interaction
2025-12-09 20:06:57,713 - INFO - \u2713 Successfully created table: fact_response_aprm
2025-12-09 20:06:59,420 - INFO - \u2713 Successfully created table: fact_vol_applctn
2025-12-09 20:07:01,100 - INFO - \u2713 Successfully created table: fact_vs_surv_resp
2025-12-09 20:07:02,746 - INFO - \u2713 Successfully created table: final_mobile_common_opt_out
2025-12-09 20:07:04,448 - INFO - \u2713 Successfully created table: fix_site_vol_recruit
2025-12-09 20:07:05,674 - WARNING - \u2717 Failed to create table: fresh_address_email_append - Error Type: ALREADY_EXISTS
2025-12-09 20:07:06,891 - WARNING - \u2717 Failed to create table: fundraising_profiles_20240507_unsubscribe_trimmed - Error Type: ALREADY_EXISTS
2025-12-09 20:07:08,461 - INFO - \u2713 Successfully created table: global_suprs_cnst_email
2025-12-09 20:07:10,113 - INFO - \u2713 Successfully created table: global_suprs_domain
2025-12-09 20:07:11,730 - INFO - \u2713 Successfully created table: global_suprs_email
2025-12-09 20:07:13,110 - WARNING - \u2717 Failed to create table: gms_arc_fr_smry - Error Type: OTHER_ERROR
2025-12-09 20:07:14,270 - WARNING - \u2717 Failed to create table: gms_arc_fr_smry_cbg - Error Type: OTHER_ERROR
2025-12-09 20:07:16,255 - INFO - \u2713 Successfully created table: gms_arc_fr_smry_sustnr
2025-12-09 20:07:17,820 - INFO - \u2713 Successfully created table: gms_arc_fr_txn
2025-12-09 20:07:19,523 - INFO - \u2713 Successfully created table: gms_bzfc_adb_fact_donation
2025-12-09 20:07:20,898 - WARNING - \u2717 Failed to create table: gms_bzfc_cdi_fr_prfr_email_profile - Error Type: ALREADY_EXISTS
2025-12-09 20:07:22,220 - WARNING - \u2717 Failed to create table: gms_bzfc_cnst_fr_prfr_em_prfl - Error Type: ALREADY_EXISTS
2025-12-09 20:07:23,755 - INFO - \u2713 Successfully created table: gms_bzfc_donation_rank
2025-12-09 20:07:25,331 - INFO - \u2713 Successfully created table: gms_bzfc_fact_ask_cntct_intrctn
2025-12-09 20:07:26,500 - WARNING - \u2717 Failed to create table: gms_bzfc_fact_email_intrctn_smry - Error Type: OTHER_ERROR
2025-12-09 20:07:28,093 - INFO - \u2713 Successfully created table: gms_bzf_cnst_cnstcy
2025-12-09 20:07:29,848 - INFO - \u2713 Successfully created table: gms_bzf_cnst_cnstcy_curnt
2025-12-09 20:07:31,464 - INFO - \u2713 Successfully created table: gms_bz_pg_group_membrshp
2025-12-09 20:07:33,146 - INFO - \u2713 Successfully created table: gms_cnst_behvrl_segmnt
2025-12-09 20:07:34,721 - INFO - \u2713 Successfully created table: gms_cnst_cdi_smry_fr_pa_dm
2025-12-09 20:07:35,894 - WARNING - \u2717 Failed to create table: gms_cnst_cdi_smry_fr_prfr - Error Type: OTHER_ERROR
2025-12-09 20:07:37,519 - INFO - \u2713 Successfully created table: gms_cnst_cdi_smry_fr_prfr_stg
2025-12-09 20:07:39,207 - INFO - \u2713 Successfully created table: gofundraise_donor
2025-12-09 20:07:40,780 - INFO - \u2713 Successfully created table: google_analytics_txn
2025-12-09 20:07:42,414 - INFO - \u2713 Successfully created table: lkp_positions_taxonomy_mktg_stg
2025-12-09 20:07:43,582 - WARNING - \u2717 Failed to create table: load_control_table - Error Type: ALREADY_EXISTS
2025-12-09 20:07:44,751 - WARNING - \u2717 Failed to create table: mktg_load_cntl - Error Type: ALREADY_EXISTS
2025-12-09 20:07:45,996 - WARNING - \u2717 Failed to create table: mktg_sky_dates - Error Type: SYNTAX_ERROR
2025-12-09 20:07:46,001 - INFO - Progress: 300/411 tables processed
2025-12-09 20:07:47,646 - INFO - \u2713 Successfully created table: mktg_snapsht_load_cntl
2025-12-09 20:07:48,921 - WARNING - \u2717 Failed to create table: mobile_commons_20240507_active - Error Type: ALREADY_EXISTS
2025-12-09 20:07:50,485 - INFO - \u2713 Successfully created table: mobile_commons_active
2025-12-09 20:07:52,276 - INFO - \u2713 Successfully created table: name_gender
2025-12-09 20:07:53,453 - WARNING - \u2717 Failed to create table: nhqmktg_cdrp_enrllmnt_ref - Error Type: ALREADY_EXISTS
2025-12-09 20:07:54,629 - WARNING - \u2717 Failed to create table: nhqmktg_cdrp_enrllmnt_sts - Error Type: ALREADY_EXISTS
2025-12-09 20:07:55,825 - WARNING - \u2717 Failed to create table: pacific_east_email_append - Error Type: ALREADY_EXISTS
2025-12-09 20:07:57,074 - WARNING - \u2717 Failed to create table: pacific_east_phone_append - Error Type: ALREADY_EXISTS
2025-12-09 20:07:58,648 - INFO - \u2713 Successfully created table: pbi_bio_demogrphcs
2025-12-09 20:08:00,281 - INFO - \u2713 Successfully created table: pbi_bzl_fact_show_prodctv_ind
2025-12-09 20:08:01,841 - INFO - \u2713 Successfully created table: pbi_cfremappend_cnst
2025-12-09 20:08:03,436 - INFO - \u2713 Successfully created table: pbi_cfremappend_cohort
2025-12-09 20:08:05,443 - INFO - \u2713 Successfully created table: pbi_entrprs_campgn_comnts
2025-12-09 20:08:07,144 - INFO - \u2713 Successfully created table: pbi_entrprs_campgn_non_adb
2025-12-09 20:08:08,711 - INFO - \u2713 Successfully created table: pbi_entrprs_campgn_results
2025-12-09 20:08:10,516 - INFO - \u2713 Successfully created table: pbi_entrprs_campgn_smry
2025-12-09 20:08:12,052 - INFO - \u2713 Successfully created table: pbi_entrprs_campgn_ts_sends
2025-12-09 20:08:13,699 - INFO - \u2713 Successfully created table: pbi_model_perf_auc
2025-12-09 20:08:15,464 - INFO - \u2713 Successfully created table: pbi_model_perf_dashbrd
2025-12-09 20:08:17,001 - INFO - \u2713 Successfully created table: pbi_model_perf_dim_lol
2025-12-09 20:08:18,692 - INFO - \u2713 Successfully created table: pbi_model_perf_tlres
2025-12-09 20:08:19,941 - WARNING - \u2717 Failed to create table: pbi_sales_pricing_budget - Error Type: ALREADY_EXISTS
2025-12-09 20:08:21,415 - WARNING - \u2717 Failed to create table: pg_calc_stuart_upld_lkp - Error Type: ALREADY_EXISTS
2025-12-09 20:08:23,016 - INFO - \u2713 Successfully created table: pg_group_ref
2025-12-09 20:08:24,603 - INFO - \u2713 Successfully created table: pg_response_log_exclusion
2025-12-09 20:08:25,811 - WARNING - \u2717 Failed to create table: pg_src_convrsn - Error Type: ALREADY_EXISTS
2025-12-09 20:08:27,401 - INFO - \u2713 Successfully created table: phone_interaction_eoc
2025-12-09 20:08:29,144 - INFO - \u2713 Successfully created table: phone_interaction_pg_eoc
2025-12-09 20:08:31,095 - INFO - \u2713 Successfully created table: phone_interaction_sustnr_upgr
2025-12-09 20:08:32,636 - INFO - \u2713 Successfully created table: pref_cnst_mstr
2025-12-09 20:08:33,816 - WARNING - \u2717 Failed to create table: prodct_distrbtn_bdgt - Error Type: ALREADY_EXISTS
2025-12-09 20:08:35,492 - INFO - \u2713 Successfully created table: replication_adb_nmsbroadlogmsg
2025-12-09 20:08:37,131 - INFO - \u2713 Successfully created table: replication_adb_nmsoperation
2025-12-09 20:08:38,319 - WARNING - \u2717 Failed to create table: replication_adb_xtkworkflow - Error Type: ALREADY_EXISTS
2025-12-09 20:08:39,501 - WARNING - \u2717 Failed to create table: replication_aprm_email_remove - Error Type: ALREADY_EXISTS
2025-12-09 20:08:41,163 - INFO - \u2713 Successfully created table: replication_dim_person
2025-12-09 20:08:42,832 - INFO - \u2713 Successfully created table: replication_dim_recipient
2025-12-09 20:08:44,548 - INFO - \u2713 Successfully created table: replication_fact_interaction_aprm
2025-12-09 20:08:46,321 - INFO - \u2713 Successfully created table: replication_rr_rqq_rql_file_xref
2025-12-09 20:08:47,855 - INFO - \u2713 Successfully created table: rr_rqq_rql_file_xref
2025-12-09 20:08:49,397 - INFO - \u2713 Successfully created table: scr
2025-12-09 20:08:51,245 - INFO - \u2713 Successfully created table: scr_val_ref
2025-12-09 20:08:52,424 - WARNING - \u2717 Failed to create table: srvy_anvrsry_vlntr_load_cntl - Error Type: ALREADY_EXISTS
2025-12-09 20:08:53,590 - WARNING - \u2717 Failed to create table: srvy_anvrsry_vlntr_questions - Error Type: ALREADY_EXISTS
2025-12-09 20:08:55,283 - WARNING - \u2717 Failed to create table: srvy_anvrsry_vlntr_questn_2_srvy_xref - Error Type: ALREADY_EXISTS
2025-12-09 20:08:56,531 - WARNING - \u2717 Failed to create table: srvy_anvrsry_vlntr_rspns_norm - Error Type: ALREADY_EXISTS
2025-12-09 20:08:57,751 - WARNING - \u2717 Failed to create table: srvy_anvrsry_vlntr_rspns_txt_norm - Error Type: OTHER_ERROR
2025-12-09 20:08:59,294 - WARNING - \u2717 Failed to create table: srvy_anvrsy_vlntr_rspns - Error Type: ALREADY_EXISTS
2025-12-09 20:09:00,513 - WARNING - \u2717 Failed to create table: srvy_anvrsy_vlntr_rspns_all - Error Type: OTHER_ERROR
2025-12-09 20:09:01,742 - WARNING - \u2717 Failed to create table: srvy_anvrsy_vlntr_rspns_cmnt - Error Type: ALREADY_EXISTS
2025-12-09 20:09:01,748 - INFO - Progress: 350/411 tables processed
2025-12-09 20:09:02,957 - WARNING - \u2717 Failed to create table: srvy_anvrsy_vlntr_rspns_cmnt_curnt - Error Type: OTHER_ERROR
2025-12-09 20:09:04,185 - WARNING - \u2717 Failed to create table: srvy_anvrsy_vlntr_rspns_fy21 - Error Type: ALREADY_EXISTS
2025-12-09 20:09:05,876 - INFO - \u2713 Successfully created table: srvy_anvrsy_vlntr_rspns_fy22
2025-12-09 20:09:07,049 - WARNING - \u2717 Failed to create table: srvy_anvrsy_vlntr_rspns_load_cntl - Error Type: ALREADY_EXISTS
2025-12-09 20:09:08,236 - WARNING - \u2717 Failed to create table: srvy_blood_sponsor_load_cntl - Error Type: ALREADY_EXISTS
2025-12-09 20:09:09,461 - WARNING - \u2717 Failed to create table: srvy_blood_sponsor_questions - Error Type: ALREADY_EXISTS
2025-12-09 20:09:10,627 - WARNING - \u2717 Failed to create table: srvy_blood_sponsor_questn_2_srvy_xref - Error Type: ALREADY_EXISTS
2025-12-09 20:09:11,820 - WARNING - \u2717 Failed to create table: srvy_blood_sponsor_respondents - Error Type: ALREADY_EXISTS
2025-12-09 20:09:13,083 - WARNING - \u2717 Failed to create table: srvy_blood_sponsor_rspns - Error Type: ALREADY_EXISTS
2025-12-09 20:09:14,270 - WARNING - \u2717 Failed to create table: srvy_dim_survey - Error Type: ALREADY_EXISTS
2025-12-09 20:09:15,558 - WARNING - \u2717 Failed to create table: srvy_dim_values - Error Type: ALREADY_EXISTS
2025-12-09 20:09:17,225 - INFO - \u2713 Successfully created table: srvy_gplg_rspns
2025-12-09 20:09:18,415 - WARNING - \u2717 Failed to create table: srvy_gplg_rspns_ss - Error Type: ALREADY_EXISTS
2025-12-09 20:09:19,596 - WARNING - \u2717 Failed to create table: srvy_hsptl_customer_contact - Error Type: ALREADY_EXISTS
2025-12-09 20:09:21,133 - WARNING - \u2717 Failed to create table: srvy_hsptl_load_cntl - Error Type: ALREADY_EXISTS
2025-12-09 20:09:22,334 - WARNING - \u2717 Failed to create table: srvy_hsptl_periods_hst - Error Type: ALREADY_EXISTS
2025-12-09 20:09:23,522 - WARNING - \u2717 Failed to create table: srvy_hsptl_questions - Error Type: ALREADY_EXISTS
2025-12-09 20:09:24,701 - WARNING - \u2717 Failed to create table: srvy_hsptl_questions_hst - Error Type: ALREADY_EXISTS
2025-12-09 20:09:25,877 - WARNING - \u2717 Failed to create table: srvy_hsptl_questn_2_srvy_xref - Error Type: ALREADY_EXISTS
2025-12-09 20:09:27,105 - WARNING - \u2717 Failed to create table: srvy_hsptl_questn_catgry - Error Type: ALREADY_EXISTS
2025-12-09 20:09:28,299 - WARNING - \u2717 Failed to create table: srvy_hsptl_respondents - Error Type: ALREADY_EXISTS
2025-12-09 20:09:29,502 - WARNING - \u2717 Failed to create table: srvy_hsptl_respondents_hst - Error Type: ALREADY_EXISTS
2025-12-09 20:09:31,201 - INFO - \u2713 Successfully created table: srvy_hsptl_respondents_hst_b4072825
2025-12-09 20:09:32,514 - WARNING - \u2717 Failed to create table: srvy_hsptl_rspns - Error Type: OTHER_ERROR
2025-12-09 20:09:33,915 - WARNING - \u2717 Failed to create table: srvy_hsptl_rspns_hst - Error Type: ALREADY_EXISTS
2025-12-09 20:09:35,275 - WARNING - \u2717 Failed to create table: srvy_hsptl_rspns_txt - Error Type: OTHER_ERROR
2025-12-09 20:09:36,737 - WARNING - \u2717 Failed to create table: srvy_hsptl_sf_contact - Error Type: ALREADY_EXISTS
2025-12-09 20:09:38,330 - WARNING - \u2717 Failed to create table: srvy_hsptl_survey - Error Type: ALREADY_EXISTS
2025-12-09 20:09:39,786 - WARNING - \u2717 Failed to create table: srvy_hsptl_survey_hst - Error Type: ALREADY_EXISTS
2025-12-09 20:09:41,202 - WARNING - \u2717 Failed to create table: srvy_hsptl_values - Error Type: ALREADY_EXISTS
2025-12-09 20:09:42,641 - WARNING - \u2717 Failed to create table: srvy_hsptl_values_hst - Error Type: ALREADY_EXISTS
2025-12-09 20:09:44,011 - WARNING - \u2717 Failed to create table: srvy_new_vlntr_load_cntl - Error Type: ALREADY_EXISTS
2025-12-09 20:09:45,390 - WARNING - \u2717 Failed to create table: srvy_new_vlntr_questions - Error Type: ALREADY_EXISTS
2025-12-09 20:09:46,779 - WARNING - \u2717 Failed to create table: srvy_new_vlntr_questn_2_srvy_xref - Error Type: ALREADY_EXISTS
2025-12-09 20:09:48,163 - WARNING - \u2717 Failed to create table: srvy_new_vlntr_rspns - Error Type: OTHER_ERROR
2025-12-09 20:09:49,550 - WARNING - \u2717 Failed to create table: srvy_new_vlntr_rspns_cmnt_curnt - Error Type: OTHER_ERROR
2025-12-09 20:09:51,460 - INFO - \u2713 Successfully created table: srvy_new_vlntr_rspns_fy21
2025-12-09 20:09:53,478 - INFO - \u2713 Successfully created table: srvy_new_vlntr_rspns_fy22
2025-12-09 20:09:54,881 - WARNING - \u2717 Failed to create table: srvy_new_vlntr_rspns_load_cntl - Error Type: ALREADY_EXISTS
2025-12-09 20:09:56,229 - WARNING - \u2717 Failed to create table: srvy_new_vlntr_rspns_norm - Error Type: ALREADY_EXISTS
2025-12-09 20:09:57,596 - WARNING - \u2717 Failed to create table: srvy_new_vlntr_rspns_txt_norm - Error Type: OTHER_ERROR
2025-12-09 20:09:59,288 - INFO - \u2713 Successfully created table: srvy_new_vlntr_rspns_v21
2025-12-09 20:10:00,532 - WARNING - \u2717 Failed to create table: srvy_rgnl_ldrshp - Error Type: ALREADY_EXISTS
2025-12-09 20:10:02,178 - INFO - \u2713 Successfully created table: srvy_rgnl_ldrshp_fy21
2025-12-09 20:10:03,401 - WARNING - \u2717 Failed to create table: srvy_rgnl_ldrshp_hst - Error Type: ALREADY_EXISTS
2025-12-09 20:10:04,582 - WARNING - \u2717 Failed to create table: srvy_rgnl_ldrshp_sent - Error Type: ALREADY_EXISTS
2025-12-09 20:10:05,756 - WARNING - \u2717 Failed to create table: srvy_vlntr_dim_values - Error Type: ALREADY_EXISTS
2025-12-09 20:10:06,914 - WARNING - \u2717 Failed to create table: srvy_vlntr_p2p_rfrl - Error Type: OTHER_ERROR
2025-12-09 20:10:08,542 - INFO - \u2713 Successfully created table: suprsn_ts_cnst
2025-12-09 20:10:11,545 - WARNING - \u2717 Failed to create table: suspect_domains - Error Type: ALREADY_EXISTS
2025-12-09 20:10:11,550 - INFO - Progress: 400/411 tables processed
2025-12-09 20:10:13,062 - INFO - \u2713 Successfully created table: sw_email_subscrb
2025-12-09 20:10:14,666 - INFO - \u2713 Successfully created table: sw_email_unsubscrb
2025-12-09 20:10:16,247 - INFO - \u2713 Successfully created table: users
2025-12-09 20:10:17,882 - INFO - \u2713 Successfully created table: utl_angry_client
2025-12-09 20:10:19,598 - INFO - \u2713 Successfully created table: utl_mcl_hard_bounces
2025-12-09 20:10:21,122 - INFO - \u2713 Successfully created table: utl_mc_bounces
2025-12-09 20:10:22,801 - INFO - \u2713 Successfully created table: utl_mc_unsubs
2025-12-09 20:10:23,977 - WARNING - \u2717 Failed to create table: vaidity_email_valdtn - Error Type: ALREADY_EXISTS
2025-12-09 20:10:25,563 - INFO - \u2713 Successfully created table: vcn_smry_intake
2025-12-09 20:10:27,187 - INFO - \u2713 Successfully created table: vms_sta_indivs
2025-12-09 20:10:28,833 - INFO - \u2713 Successfully created table: vms_sta_orgs
2025-12-09 20:10:30,001 - WARNING - \u2717 Failed to create table: _zeroetl_watermark - Error Type: OTHER_ERROR
2025-12-09 20:10:30,006 - INFO - ================================================================================
2025-12-09 20:10:30,006 - INFO - EXECUTION SUMMARY
2025-12-09 20:10:30,006 - INFO - ================================================================================
2025-12-09 20:10:30,006 - INFO - Object Type: TABLE
2025-12-09 20:10:30,006 - INFO - Schema: mktg_ops_tbls
2025-12-09 20:10:30,006 - INFO - Total Objects: 411
2025-12-09 20:10:30,006 - INFO - Successfully Created: 238
2025-12-09 20:10:30,006 - INFO - Failed: 173
2025-12-09 20:10:30,006 - INFO - Success Rate: 57.91%
2025-12-09 20:10:30,006 - INFO - Created objects saved to: D:\fetch_ddl_from_rs\Create_DDL_Output\ddl_output\mktg_ops_tbls_tables_20251209_200003_created.csv
2025-12-09 20:10:30,007 - INFO - Errored objects saved to: D:\fetch_ddl_from_rs\Create_DDL_Output\ddl_output\mktg_ops_tbls_tables_20251209_200003_errored.csv
2025-12-09 20:10:30,007 - INFO - ================================================================================
2025-12-09 20:10:30,007 - INFO - Connection closed. Script execution completed.
