2025-12-09 13:33:18,096 - INFO - ================================================================================
2025-12-09 13:33:18,096 - INFO - Starting DDL Execution Script - mktg_ops_vws_views
2025-12-09 13:33:18,096 - INFO - Timestamp: 20251209_133318
2025-12-09 13:33:18,096 - INFO - ================================================================================
2025-12-09 13:33:18,096 - INFO - Configuration loaded successfully
2025-12-09 13:33:18,097 - INFO - Log file: D:\fetch_ddl_from_rs\Create_DDL_Output\ddl_logs\mktg_ops_vws_views_20251209_133318_log.log
2025-12-09 13:33:21,189 - INFO - Successfully connected to Redshift DEV: redshift.dev.datahub.redcross.net
2025-12-09 13:33:21,192 - INFO - Database: mods_bi, User: hritik_singhania
2025-12-09 13:33:21,207 - INFO - Initialized CSV files with timestamp: 20251209_133321
2025-12-09 13:33:21,207 - INFO -   - Created: D:\fetch_ddl_from_rs\Create_DDL_Output\ddl_output\mktg_ops_vws_views_20251209_133321_created.csv
2025-12-09 13:33:21,208 - INFO -   - Errored: D:\fetch_ddl_from_rs\Create_DDL_Output\ddl_output\mktg_ops_vws_views_20251209_133321_errored.csv
2025-12-09 13:33:21,209 - INFO - Found 317 SQL files in D:\fetch_ddl_from_rs\Fetch_DDL_Output\ddl_output\mktg_ops_vws
2025-12-09 13:33:21,210 - INFO - ================================================================================
2025-12-09 13:33:21,210 - INFO - Processing Configuration:
2025-12-09 13:33:21,210 - INFO -   - Schema: mktg_ops_vws
2025-12-09 13:33:21,210 - INFO -   - Object Type: VIEW
2025-12-09 13:33:21,210 - INFO -   - Total Objects: 317
2025-12-09 13:33:21,210 - INFO -   - Run Identifier: mktg_ops_vws_views
2025-12-09 13:33:21,210 - INFO - ================================================================================
2025-12-09 13:33:22,724 - INFO - \u2713 Successfully created view: actvty_vwthrgh
2025-12-09 13:33:24,154 - INFO - \u2713 Successfully created view: adb_arcgms_broadlog
2025-12-09 13:33:25,731 - INFO - \u2713 Successfully created view: adb_nmsbroadlogrcp
2025-12-09 13:33:27,158 - INFO - \u2713 Successfully created view: adb_nmsrecipient
2025-12-09 13:33:28,222 - WARNING - \u2717 Failed to create view: arc_biomed_gender_race - Error Type: SYNTAX_ERROR
2025-12-09 13:33:29,326 - WARNING - \u2717 Failed to create view: arc_biomed_smry - Error Type: OTHER_ERROR
2025-12-09 13:33:30,402 - WARNING - \u2717 Failed to create view: arc_biomed_txn - Error Type: OTHER_ERROR
2025-12-09 13:33:31,861 - INFO - \u2713 Successfully created view: arc_biomed_txn_ext_staff
2025-12-09 13:33:33,391 - INFO - \u2713 Successfully created view: arc_entrprs_smry
2025-12-09 13:33:34,821 - INFO - \u2713 Successfully created view: arc_glossary
2025-12-09 13:33:36,208 - INFO - \u2713 Successfully created view: arc_phss_smry
2025-12-09 13:33:37,656 - INFO - \u2713 Successfully created view: arc_phss_txn
2025-12-09 13:33:38,993 - INFO - \u2713 Successfully created view: arc_vms_smry
2025-12-09 13:33:40,418 - INFO - \u2713 Successfully created view: arc_vms_txn
2025-12-09 13:33:41,989 - INFO - \u2713 Successfully created view: atg_order_registrants
2025-12-09 13:33:43,434 - INFO - \u2713 Successfully created view: atg_registrants
2025-12-09 13:33:44,809 - INFO - \u2713 Successfully created view: bzfc_active_cnst_segmnt
2025-12-09 13:33:46,224 - INFO - \u2713 Successfully created view: bzfc_active_cnst_snpsht
2025-12-09 13:33:47,624 - INFO - \u2713 Successfully created view: bzfc_adb_recipient_insrt_delta
2025-12-09 13:33:49,020 - INFO - \u2713 Successfully created view: bzfc_adb_recipient_updt_delta
2025-12-09 13:33:50,499 - INFO - \u2713 Successfully created view: bzfc_arc_best_smry
2025-12-09 13:33:51,922 - INFO - \u2713 Successfully created view: bzfc_cdi_bio_prfr_email_profile
2025-12-09 13:33:53,327 - INFO - \u2713 Successfully created view: bzfc_cnst_cdi_fr_prfr_em_prfl
2025-12-09 13:33:54,404 - WARNING - \u2717 Failed to create view: bzfc_cnst_cdi_phss_email_prfl - Error Type: OTHER_ERROR
2025-12-09 13:33:55,469 - WARNING - \u2717 Failed to create view: bzfc_cnst_fr_prfr_flags - Error Type: SYNTAX_ERROR
2025-12-09 13:33:56,542 - WARNING - \u2717 Failed to create view: bzfc_comnictn_src - Error Type: OTHER_ERROR
2025-12-09 13:33:57,968 - INFO - \u2713 Successfully created view: bzfc_dim_unit_merged
2025-12-09 13:33:59,500 - INFO - \u2713 Successfully created view: bzfc_email_append
2025-12-09 13:34:00,881 - INFO - \u2713 Successfully created view: bzfc_fact_dmail_interaction
2025-12-09 13:34:02,293 - INFO - \u2713 Successfully created view: bzfc_fact_dmail_intrctn_norm
2025-12-09 13:34:03,733 - INFO - \u2713 Successfully created view: bzfc_fact_email_interaction
2025-12-09 13:34:05,142 - INFO - \u2713 Successfully created view: bzfc_fact_interaction
2025-12-09 13:34:06,511 - INFO - \u2713 Successfully created view: bzfc_fact_interaction_all
2025-12-09 13:34:07,920 - INFO - \u2713 Successfully created view: bzfc_fact_interaction_em_smry
2025-12-09 13:34:09,301 - INFO - \u2713 Successfully created view: bzfc_fact_phone_interaction
2025-12-09 13:34:10,739 - INFO - \u2713 Successfully created view: bzfc_fact_phone_interaction_pg
2025-12-09 13:34:12,123 - INFO - \u2713 Successfully created view: bzfc_fact_response_all
2025-12-09 13:34:13,522 - INFO - \u2713 Successfully created view: bzfc_fact_sms_interaction
2025-12-09 13:34:14,581 - WARNING - \u2717 Failed to create view: bzfc_fr_cnst_in_blood_region - Error Type: SYNTAX_ERROR
2025-12-09 13:34:16,029 - INFO - \u2713 Successfully created view: bzfc_fsa_ask
2025-12-09 13:34:17,088 - WARNING - \u2717 Failed to create view: bzfc_fsa_cnst_indv_chrctrs2 - Error Type: SYNTAX_ERROR
2025-12-09 13:34:18,517 - INFO - \u2713 Successfully created view: bzfc_fsa_cnst_indv_cntct_prefc
2025-12-09 13:34:19,580 - WARNING - \u2717 Failed to create view: bzfc_fsa_cnst_org_chrctrs2 - Error Type: SYNTAX_ERROR
2025-12-09 13:34:20,639 - WARNING - \u2717 Failed to create view: bzfc_fsa_cnst_org_cntct_prefc - Error Type: SYNTAX_ERROR
2025-12-09 13:34:22,326 - INFO - \u2713 Successfully created view: bzfc_pg_response_log
2025-12-09 13:34:23,781 - INFO - \u2713 Successfully created view: bzfc_pg_response_log_ref
2025-12-09 13:34:25,185 - INFO - \u2713 Successfully created view: bzfc_phone_append
2025-12-09 13:34:26,251 - WARNING - \u2717 Failed to create view: bzfc_prospect_pt_scr_fin - Error Type: SYNTAX_ERROR
2025-12-09 13:34:27,310 - WARNING - \u2717 Failed to create view: bzfc_prospect_pt_scr_nonfin - Error Type: SYNTAX_ERROR
2025-12-09 13:34:27,318 - INFO - Progress: 50/317 views processed
2025-12-09 13:34:28,369 - WARNING - \u2717 Failed to create view: bzfc_sms_bio_prfl - Error Type: SYNTAX_ERROR
2025-12-09 13:34:29,751 - INFO - \u2713 Successfully created view: bzfc_sms_fr_prf
2025-12-09 13:34:31,227 - INFO - \u2713 Successfully created view: bzfc_sms_fr_prfl
2025-12-09 13:34:32,648 - INFO - \u2713 Successfully created view: bzfc_sms_phss_prfl
2025-12-09 13:34:34,098 - INFO - \u2713 Successfully created view: bzfc_sms_profile
2025-12-09 13:34:35,816 - INFO - \u2713 Successfully created view: bzfc_sms_vms_prfl
2025-12-09 13:34:37,291 - INFO - \u2713 Successfully created view: bzfc_sponsor_journey_detail
2025-12-09 13:34:38,894 - INFO - \u2713 Successfully created view: bzfc_sponsor_journey_smry
2025-12-09 13:34:40,253 - INFO - \u2713 Successfully created view: bzfc_taxo_bio_collection_curr
2025-12-09 13:34:41,691 - INFO - \u2713 Successfully created view: bzfc_taxo_humanitarian_curr
2025-12-09 13:34:43,097 - INFO - \u2713 Successfully created view: bzfc_taxo_subscr_gplg
2025-12-09 13:34:44,500 - INFO - \u2713 Successfully created view: bzfc_trigrd_campgn_smry
2025-12-09 13:34:45,867 - INFO - \u2713 Successfully created view: bzfc_vms_cnst_in_blood_region
2025-12-09 13:34:47,262 - INFO - \u2713 Successfully created view: bzf_cem_cnst_msg_pref
2025-12-09 13:34:48,348 - WARNING - \u2717 Failed to create view: bzf_cem_cnst_opt_outs - Error Type: PERMISSION_ERROR
2025-12-09 13:34:49,781 - INFO - \u2713 Successfully created view: bzf_cem_fr_cnst_loc_prefs
2025-12-09 13:34:51,157 - INFO - \u2713 Successfully created view: bzf_cnst_chrctrstc
2025-12-09 13:34:52,573 - INFO - \u2713 Successfully created view: bzf_cnst_chrctrstc_arcpg
2025-12-09 13:34:53,632 - WARNING - \u2717 Failed to create view: bzf_cnst_chrctrstc_simio - Error Type: SYNTAX_ERROR
2025-12-09 13:34:55,015 - INFO - \u2713 Successfully created view: bzf_cnst_scr
2025-12-09 13:34:56,427 - INFO - \u2713 Successfully created view: bzf_cnst_scr_simio
2025-12-09 13:34:57,491 - WARNING - \u2717 Failed to create view: bzf_prospect_pt_scr - Error Type: SYNTAX_ERROR
2025-12-09 13:34:58,919 - INFO - \u2713 Successfully created view: bzl_cnst_fsa_acqstn
2025-12-09 13:34:59,980 - WARNING - \u2717 Failed to create view: bzl_cnst_mstr_fsa_acct_cntct - Error Type: SYNTAX_ERROR
2025-12-09 13:35:01,389 - INFO - \u2713 Successfully created view: bzl_vms_sta_shift_smry
2025-12-09 13:35:02,466 - WARNING - \u2717 Failed to create view: bz_adb_arcbitlyreturn - Error Type: OTHER_ERROR
2025-12-09 13:35:03,909 - INFO - \u2713 Successfully created view: bz_adb_arcgms_broadlog
2025-12-09 13:35:04,973 - WARNING - \u2717 Failed to create view: bz_adb_arcprefchangefr - Error Type: OTHER_ERROR
2025-12-09 13:35:06,049 - WARNING - \u2717 Failed to create view: bz_adb_arcreportcellcode - Error Type: OTHER_ERROR
2025-12-09 13:35:07,113 - WARNING - \u2717 Failed to create view: bz_adb_arctreatmentcode - Error Type: OTHER_ERROR
2025-12-09 13:35:08,521 - INFO - \u2713 Successfully created view: bz_adb_enumrtn_lkp
2025-12-09 13:35:09,590 - WARNING - \u2717 Failed to create view: bz_adb_nmsaddress - Error Type: OTHER_ERROR
2025-12-09 13:35:10,656 - WARNING - \u2717 Failed to create view: bz_adb_nmsbroadlogmsg - Error Type: OTHER_ERROR
2025-12-09 13:35:12,049 - INFO - \u2713 Successfully created view: bz_adb_nmsbroadlogrcp
2025-12-09 13:35:13,486 - INFO - \u2713 Successfully created view: bz_adb_nmsdelivery
2025-12-09 13:35:14,949 - INFO - \u2713 Successfully created view: bz_adb_nmsexcludelogrcp
2025-12-09 13:35:16,015 - WARNING - \u2717 Failed to create view: bz_adb_nmsinsms - Error Type: OTHER_ERROR
2025-12-09 13:35:17,097 - WARNING - \u2717 Failed to create view: bz_adb_nmsrecipient - Error Type: OTHER_ERROR
2025-12-09 13:35:18,176 - WARNING - \u2717 Failed to create view: bz_adb_nmsservice - Error Type: OTHER_ERROR
2025-12-09 13:35:19,245 - WARNING - \u2717 Failed to create view: bz_adb_nmssubscription - Error Type: OTHER_ERROR
2025-12-09 13:35:20,325 - WARNING - \u2717 Failed to create view: bz_adb_nmstrackinglogrcp - Error Type: OTHER_ERROR
2025-12-09 13:35:21,725 - INFO - \u2713 Successfully created view: bz_adb_nmstrackingurl
2025-12-09 13:35:22,788 - WARNING - \u2717 Failed to create view: bz_adb_nmsuseragent - Error Type: OTHER_ERROR
2025-12-09 13:35:24,193 - INFO - \u2713 Successfully created view: bz_adb_nmswebapp
2025-12-09 13:35:25,261 - WARNING - \u2717 Failed to create view: bz_adb_nmswebapplogrcp - Error Type: OTHER_ERROR
2025-12-09 13:35:26,351 - WARNING - \u2717 Failed to create view: bz_adb_nmswebapplogrcpdata - Error Type: OTHER_ERROR
2025-12-09 13:35:27,781 - INFO - \u2713 Successfully created view: bz_aprm_email_bncd
2025-12-09 13:35:29,289 - INFO - \u2713 Successfully created view: bz_aprm_email_lnk_clkd
2025-12-09 13:35:30,672 - INFO - \u2713 Successfully created view: bz_aprm_email_opened
2025-12-09 13:35:32,060 - INFO - \u2713 Successfully created view: bz_aprm_email_remove
2025-12-09 13:35:32,070 - INFO - Progress: 100/317 views processed
2025-12-09 13:35:33,456 - INFO - \u2713 Successfully created view: bz_aprm_email_sent
2025-12-09 13:35:34,864 - INFO - \u2713 Successfully created view: bz_aprm_wb_apnd_prfrnc_cntr
2025-12-09 13:35:36,314 - INFO - \u2713 Successfully created view: bz_aprm_wb_apnd_unsubs_rplc
2025-12-09 13:35:37,702 - INFO - \u2713 Successfully created view: bz_aprm_wb_rplc_fr_prf_cntr_lt
2025-12-09 13:35:37,714 - ERROR - Error reading SQL file bz_arcpg_response_typ.sql: 'utf-8' codec can't decode byte 0x96 in position 447: invalid start byte
2025-12-09 13:35:37,714 - ERROR - Skipping bz_arcpg_response_typ - Could not read SQL file
2025-12-09 13:35:39,121 - INFO - \u2713 Successfully created view: bz_arc_comm_log
2025-12-09 13:35:40,544 - INFO - \u2713 Successfully created view: bz_arc_fr_smry_atg_first_tm
2025-12-09 13:35:41,941 - INFO - \u2713 Successfully created view: bz_arc_fr_smry_rco_first_tm
2025-12-09 13:35:43,334 - INFO - \u2713 Successfully created view: bz_arc_fr_smry_rco_last_donat
2025-12-09 13:35:44,736 - INFO - \u2713 Successfully created view: bz_arc_fr_smry_rco_last_sustnr_donat
2025-12-09 13:35:45,801 - WARNING - \u2717 Failed to create view: bz_arc_fr_smry_rco_smry - Error Type: SYNTAX_ERROR
2025-12-09 13:35:47,148 - INFO - \u2713 Successfully created view: bz_area_code_2_time_zone
2025-12-09 13:35:48,214 - WARNING - \u2717 Failed to create view: bz_campgn_yr_end_dow_projctn - Error Type: OTHER_ERROR
2025-12-09 13:35:49,624 - INFO - \u2713 Successfully created view: bz_cnst_birth_best
2025-12-09 13:35:51,058 - INFO - \u2713 Successfully created view: bz_cnst_birth_pg
2025-12-09 13:35:52,486 - INFO - \u2713 Successfully created view: bz_cnst_cnstcy_affn
2025-12-09 13:35:53,906 - INFO - \u2713 Successfully created view: bz_cnst_fsa_acqstn
2025-12-09 13:35:55,412 - INFO - \u2713 Successfully created view: bz_cnst_gender_best
2025-12-09 13:35:56,905 - INFO - \u2713 Successfully created view: bz_cnst_mstr
2025-12-09 13:35:58,241 - INFO - \u2713 Successfully created view: bz_comnictn_src
2025-12-09 13:35:59,807 - INFO - \u2713 Successfully created view: bz_cur_mth_bio_donor_freq
2025-12-09 13:36:01,180 - INFO - \u2713 Successfully created view: bz_digital_analytics_txn
2025-12-09 13:36:02,602 - INFO - \u2713 Successfully created view: bz_dim_appt_typ
2025-12-09 13:36:03,981 - INFO - \u2713 Successfully created view: bz_dim_campgn
2025-12-09 13:36:05,350 - INFO - \u2713 Successfully created view: bz_dim_channel
2025-12-09 13:36:06,715 - INFO - \u2713 Successfully created view: bz_dim_cnst_demographic
2025-12-09 13:36:08,099 - INFO - \u2713 Successfully created view: bz_dim_delivery
2025-12-09 13:36:09,531 - INFO - \u2713 Successfully created view: bz_dim_dm_src_treatmnt_xref
2025-12-09 13:36:10,912 - INFO - \u2713 Successfully created view: bz_dim_edrtl_response_period
2025-12-09 13:36:12,301 - INFO - \u2713 Successfully created view: bz_dim_email_intrctn_typ
2025-12-09 13:36:13,719 - INFO - \u2713 Successfully created view: bz_dim_fund_cd
2025-12-09 13:36:15,111 - INFO - \u2713 Successfully created view: bz_dim_operator
2025-12-09 13:36:16,610 - INFO - \u2713 Successfully created view: bz_dim_phone_adtnl_reqst
2025-12-09 13:36:18,035 - INFO - \u2713 Successfully created view: bz_dim_phone_call_dspstn
2025-12-09 13:36:19,096 - WARNING - \u2717 Failed to create view: bz_dim_phone_campgn - Error Type: SYNTAX_ERROR
2025-12-09 13:36:20,152 - WARNING - \u2717 Failed to create view: bz_dim_phone_campgn_src_cd_xref - Error Type: SYNTAX_ERROR
2025-12-09 13:36:21,205 - WARNING - \u2717 Failed to create view: bz_dim_phone_script - Error Type: SYNTAX_ERROR
2025-12-09 13:36:22,610 - INFO - \u2713 Successfully created view: bz_dim_rpt_cell_cd
2025-12-09 13:36:24,070 - INFO - \u2713 Successfully created view: bz_dim_treatmnt
2025-12-09 13:36:25,129 - WARNING - \u2717 Failed to create view: bz_dim_unit - Error Type: SYNTAX_ERROR
2025-12-09 13:36:26,557 - INFO - \u2713 Successfully created view: bz_dim_zipcodes
2025-12-09 13:36:27,939 - INFO - \u2713 Successfully created view: bz_email_src_cd
2025-12-09 13:36:29,348 - INFO - \u2713 Successfully created view: bz_fund
2025-12-09 13:36:30,412 - WARNING - \u2717 Failed to create view: bz_geo_zip_code_to_chapter - Error Type: PERMISSION_ERROR
2025-12-09 13:36:31,925 - INFO - \u2713 Successfully created view: bz_gms_arc_fr_txn_segmnt
2025-12-09 13:36:32,995 - WARNING - \u2717 Failed to create view: bz_grp_mbrshp - Error Type: PERMISSION_ERROR
2025-12-09 13:36:34,051 - WARNING - \u2717 Failed to create view: bz_grp_ref - Error Type: SYNTAX_ERROR
2025-12-09 13:36:35,512 - INFO - \u2713 Successfully created view: bz_microsites_report
2025-12-09 13:36:36,906 - INFO - \u2713 Successfully created view: bz_pg_group_membrshp
2025-12-09 13:36:38,272 - INFO - \u2713 Successfully created view: bz_pg_group_ref
2025-12-09 13:36:38,279 - INFO - Progress: 150/317 views processed
2025-12-09 13:36:39,683 - INFO - \u2713 Successfully created view: bz_pg_response_log_exclusion
2025-12-09 13:36:40,749 - WARNING - \u2717 Failed to create view: bz_pg_src_convrsn - Error Type: PERMISSION_ERROR
2025-12-09 13:36:41,809 - WARNING - \u2717 Failed to create view: bz_prospect_pt_scr - Error Type: SYNTAX_ERROR
2025-12-09 13:36:43,392 - INFO - \u2713 Successfully created view: bz_rr_dm_srccd_aprm_cellcd
2025-12-09 13:36:44,826 - INFO - \u2713 Successfully created view: bz_scr
2025-12-09 13:36:46,189 - INFO - \u2713 Successfully created view: campgn_prospct_list
2025-12-09 13:36:47,554 - INFO - \u2713 Successfully created view: chptr_list_membrshp
2025-12-09 13:36:48,915 - INFO - \u2713 Successfully created view: chptr_portal_list_typ_ref
2025-12-09 13:36:50,364 - INFO - \u2713 Successfully created view: cnst_addr_ncoa_log
2025-12-09 13:36:52,357 - INFO - \u2713 Successfully created view: cnst_addr_ncoa_log_1
2025-12-09 13:36:53,423 - WARNING - \u2717 Failed to create view: cnst_cdi_bio_preferred_dmail - Error Type: OTHER_ERROR
2025-12-09 13:36:54,495 - WARNING - \u2717 Failed to create view: cnst_cdi_bio_preferred_email - Error Type: OTHER_ERROR
2025-12-09 13:36:55,935 - INFO - \u2713 Successfully created view: cnst_cdi_phss_preferred_dmail
2025-12-09 13:36:57,381 - INFO - \u2713 Successfully created view: cnst_cdi_phss_preferred_email
2025-12-09 13:36:58,453 - WARNING - \u2717 Failed to create view: cnst_cdi_smry_bio_prfr - Error Type: PERMISSION_ERROR
2025-12-09 13:36:59,840 - INFO - \u2713 Successfully created view: cnst_cdi_smry_non_fr_prfr
2025-12-09 13:37:01,252 - INFO - \u2713 Successfully created view: cnst_cdi_smry_phss_prfr
2025-12-09 13:37:02,671 - INFO - \u2713 Successfully created view: cnst_cdi_smry_vms_prfr
2025-12-09 13:37:03,728 - WARNING - \u2717 Failed to create view: cnst_cdi_src_profile_mb - Error Type: SYNTAX_ERROR
2025-12-09 13:37:05,124 - INFO - \u2713 Successfully created view: cnst_mstr_id_map
2025-12-09 13:37:06,489 - INFO - \u2713 Successfully created view: cnst_sturt_lst_affl
2025-12-09 13:37:07,555 - WARNING - \u2717 Failed to create view: cnvo_cnst - Error Type: SYNTAX_ERROR
2025-12-09 13:37:09,016 - INFO - \u2713 Successfully created view: cnvo_group_acct
2025-12-09 13:37:10,512 - INFO - \u2713 Successfully created view: cnvo_group_members
2025-12-09 13:37:11,925 - INFO - \u2713 Successfully created view: dim_age_band
2025-12-09 13:37:13,352 - INFO - \u2713 Successfully created view: dim_bio_mstr_cust_appnd
2025-12-09 13:37:14,433 - WARNING - \u2717 Failed to create view: dim_calendar - Error Type: PERMISSION_ERROR
2025-12-09 13:37:15,843 - INFO - \u2713 Successfully created view: dim_email_segmnt
2025-12-09 13:37:16,901 - WARNING - \u2717 Failed to create view: dim_gl_acct - Error Type: SYNTAX_ERROR
2025-12-09 13:37:18,289 - INFO - \u2713 Successfully created view: dim_isp_labor
2025-12-09 13:37:19,658 - INFO - \u2713 Successfully created view: dim_motvtn_clt_matrix
2025-12-09 13:37:21,029 - INFO - \u2713 Successfully created view: dim_motvtn_gplg_effort
2025-12-09 13:37:22,413 - INFO - \u2713 Successfully created view: dim_motvtn_gplg_scr
2025-12-09 13:37:23,808 - INFO - \u2713 Successfully created view: dim_motvtn_gplg_segmnt
2025-12-09 13:37:25,239 - INFO - \u2713 Successfully created view: dim_recipient
2025-12-09 13:37:26,746 - INFO - \u2713 Successfully created view: dim_src_2_intrctn_brdg
2025-12-09 13:37:27,801 - WARNING - \u2717 Failed to create view: dim_state - Error Type: SYNTAX_ERROR
2025-12-09 13:37:28,902 - WARNING - \u2717 Failed to create view: dim_unit - Error Type: SYNTAX_ERROR
2025-12-09 13:37:29,959 - WARNING - \u2717 Failed to create view: dim_unit_merged - Error Type: SYNTAX_ERROR
2025-12-09 13:37:31,612 - INFO - \u2713 Successfully created view: dim_volunteer
2025-12-09 13:37:33,035 - INFO - \u2713 Successfully created view: dv_active_segmnt_snapsht
2025-12-09 13:37:34,468 - INFO - \u2713 Successfully created view: dv_digtl_engmnt_scorcrd
2025-12-09 13:37:35,965 - INFO - \u2713 Successfully created view: esri_blockgroup_demgrphc
2025-12-09 13:37:37,378 - INFO - \u2713 Successfully created view: esri_zip_cd_demgrphc
2025-12-09 13:37:38,829 - INFO - \u2713 Successfully created view: fact_atg_order_line
2025-12-09 13:37:40,300 - INFO - \u2713 Successfully created view: fact_dmail_interaction
2025-12-09 13:37:41,749 - INFO - \u2713 Successfully created view: fact_email_interaction
2025-12-09 13:37:43,127 - INFO - \u2713 Successfully created view: fact_interaction_aprm
2025-12-09 13:37:44,752 - INFO - \u2713 Successfully created view: fact_vol_applctn
2025-12-09 13:37:45,818 - WARNING - \u2717 Failed to create view: fresh_address_email_append - Error Type: OTHER_ERROR
2025-12-09 13:37:45,826 - INFO - Progress: 200/317 views processed
2025-12-09 13:37:47,169 - INFO - \u2713 Successfully created view: fr_asset_gift_smry
2025-12-09 13:37:48,549 - INFO - \u2713 Successfully created view: geo_zip_code_to_chapter
2025-12-09 13:37:50,008 - INFO - \u2713 Successfully created view: gmpbzal_dim_fund
2025-12-09 13:37:51,387 - INFO - \u2713 Successfully created view: gmpbzal_dim_src
2025-12-09 13:37:52,979 - INFO - \u2713 Successfully created view: gmpbz_chpt_cnst_cnstcy
2025-12-09 13:37:54,353 - INFO - \u2713 Successfully created view: gmpbz_cnst_comnictn_email
2025-12-09 13:37:55,744 - INFO - \u2713 Successfully created view: gmpbz_dim_arcpg_amt_typ
2025-12-09 13:37:57,139 - INFO - \u2713 Successfully created view: gmpbz_dim_arcpg_chan_typ
2025-12-09 13:37:58,535 - INFO - \u2713 Successfully created view: gmpbz_dim_arcpg_comnictn_typ
2025-12-09 13:37:58,548 - ERROR - Error reading SQL file gmpbz_dim_arcpg_response_typ.sql: 'utf-8' codec can't decode byte 0x96 in position 324: invalid start byte
2025-12-09 13:37:58,548 - ERROR - Skipping gmpbz_dim_arcpg_response_typ - Could not read SQL file
2025-12-09 13:37:59,918 - INFO - \u2713 Successfully created view: gmpbz_dim_arcpg_src
2025-12-09 13:38:01,301 - INFO - \u2713 Successfully created view: gmpbz_dim_comnictn
2025-12-09 13:38:02,371 - WARNING - \u2717 Failed to create view: gmpbz_dim_dntn_chan - Error Type: PERMISSION_ERROR
2025-12-09 13:38:03,887 - INFO - \u2713 Successfully created view: gmpbz_dim_dollar_tier
2025-12-09 13:38:05,347 - INFO - \u2713 Successfully created view: gmpbz_dim_fund
2025-12-09 13:38:06,409 - WARNING - \u2717 Failed to create view: gmpbz_dim_giftran - Error Type: SYNTAX_ERROR
2025-12-09 13:38:07,830 - INFO - \u2713 Successfully created view: gmpbz_dim_giftran_typ
2025-12-09 13:38:08,902 - WARNING - \u2717 Failed to create view: gmpbz_dim_gift_stg - Error Type: SYNTAX_ERROR
2025-12-09 13:38:09,982 - WARNING - \u2717 Failed to create view: gmpbz_dim_gl_fcc - Error Type: SYNTAX_ERROR
2025-12-09 13:38:11,552 - INFO - \u2713 Successfully created view: gmpbz_dim_intrctn_typ
2025-12-09 13:38:13,028 - INFO - \u2713 Successfully created view: gmpbz_dim_merchant
2025-12-09 13:38:14,420 - INFO - \u2713 Successfully created view: gmpbz_dim_pmt_mthd
2025-12-09 13:38:15,835 - INFO - \u2713 Successfully created view: gmpbz_dim_prog
2025-12-09 13:38:17,277 - INFO - \u2713 Successfully created view: gmpbz_dim_rgnrt_reason
2025-12-09 13:38:18,942 - INFO - \u2713 Successfully created view: gmpbz_dim_src
2025-12-09 13:38:20,336 - INFO - \u2713 Successfully created view: gmpbz_dim_sustnr_typ
2025-12-09 13:38:21,719 - INFO - \u2713 Successfully created view: gmpbz_dim_vendor
2025-12-09 13:38:23,174 - INFO - \u2713 Successfully created view: gmpbz_fact_arcpg_cnst_comnictn
2025-12-09 13:38:24,226 - WARNING - \u2717 Failed to create view: gmpbz_gift_addr - Error Type: SYNTAX_ERROR
2025-12-09 13:38:25,651 - INFO - \u2713 Successfully created view: gmpbz_gift_premium
2025-12-09 13:38:27,063 - INFO - \u2713 Successfully created view: gmpbz_gift_sku
2025-12-09 13:38:28,529 - INFO - \u2713 Successfully created view: gms_arc_fr_smry
2025-12-09 13:38:29,934 - INFO - \u2713 Successfully created view: gms_arc_fr_smry_cbg
2025-12-09 13:38:31,403 - INFO - \u2713 Successfully created view: gms_arc_fr_smry_sustnr
2025-12-09 13:38:32,914 - INFO - \u2713 Successfully created view: gms_arc_fr_txn
2025-12-09 13:38:34,392 - INFO - \u2713 Successfully created view: gms_arc_fr_txn_sustnr
2025-12-09 13:38:35,800 - INFO - \u2713 Successfully created view: gms_bzfc_adb_fact_donation
2025-12-09 13:38:36,887 - WARNING - \u2717 Failed to create view: gms_bzfc_cnst_cdi_fr_prfr_em_prfl - Error Type: OTHER_ERROR
2025-12-09 13:38:38,330 - INFO - \u2713 Successfully created view: gms_bzfc_dim_unf_fr_cnst
2025-12-09 13:38:39,738 - INFO - \u2713 Successfully created view: gms_bzfc_donation_rank
2025-12-09 13:38:41,244 - INFO - \u2713 Successfully created view: gms_bzfc_fact_ask
2025-12-09 13:38:42,675 - INFO - \u2713 Successfully created view: gms_bzfc_fact_ask_cntct_intrctn
2025-12-09 13:38:44,148 - INFO - \u2713 Successfully created view: gms_bzfc_fact_cnst_comnictn
2025-12-09 13:38:45,689 - INFO - \u2713 Successfully created view: gms_bzfc_fact_email_intrctn_smry
2025-12-09 13:38:47,095 - INFO - \u2713 Successfully created view: gms_bzfc_fact_giftran
2025-12-09 13:38:48,498 - INFO - \u2713 Successfully created view: gms_bzf_cnst_cnstcy
2025-12-09 13:38:50,060 - INFO - \u2713 Successfully created view: gms_bzf_cnst_cnstcy_curnt
2025-12-09 13:38:51,459 - INFO - \u2713 Successfully created view: gms_bz_pg_group_membrshp
2025-12-09 13:38:52,870 - INFO - \u2713 Successfully created view: gms_cnst_cdi_smry_fr_pa_dm
2025-12-09 13:38:53,933 - WARNING - \u2717 Failed to create view: gms_cnst_cdi_smry_fr_prfr - Error Type: SYNTAX_ERROR
2025-12-09 13:38:53,942 - INFO - Progress: 250/317 views processed
2025-12-09 13:38:55,307 - INFO - \u2713 Successfully created view: gms_frfbz_dim_tag
2025-12-09 13:38:56,647 - WARNING - \u2717 Failed to create view: gms_pg_group_membrshp_src - Error Type: SYNTAX_ERROR
2025-12-09 13:38:58,039 - INFO - \u2713 Successfully created view: gms_sf_acct_contct_brdg
2025-12-09 13:38:59,448 - INFO - \u2713 Successfully created view: lkp_adb_intrctn_status_dsc
2025-12-09 13:39:00,515 - WARNING - \u2717 Failed to create view: mktg_sky_dates - Error Type: OTHER_ERROR
2025-12-09 13:39:02,029 - INFO - \u2713 Successfully created view: nhqmktg_cdrp_enrllmnt_sts
2025-12-09 13:39:03,106 - WARNING - \u2717 Failed to create view: pacific_east_email_append - Error Type: OTHER_ERROR
2025-12-09 13:39:04,554 - INFO - \u2713 Successfully created view: pbi_bzl_fact_show_prodctv_ind
2025-12-09 13:39:05,929 - INFO - \u2713 Successfully created view: pbi_entrprs_campgn_comnts
2025-12-09 13:39:07,365 - INFO - \u2713 Successfully created view: pbi_entrprs_campgn_results
2025-12-09 13:39:08,773 - INFO - \u2713 Successfully created view: pbi_entrprs_campgn_smry
2025-12-09 13:39:09,860 - WARNING - \u2717 Failed to create view: pbi_sales_pricing_budget - Error Type: OTHER_ERROR
2025-12-09 13:39:11,269 - INFO - \u2713 Successfully created view: phone_interaction_eoc
2025-12-09 13:39:12,668 - INFO - \u2713 Successfully created view: phone_interaction_pg_eoc
2025-12-09 13:39:13,739 - WARNING - \u2717 Failed to create view: prodct_distrbtn_bdgt - Error Type: PERMISSION_ERROR
2025-12-09 13:39:15,220 - INFO - \u2713 Successfully created view: rr_rqq_rql_file_xref
2025-12-09 13:39:16,669 - INFO - \u2713 Successfully created view: rr_rqq_rql_file_xref_mtvtn_cd
2025-12-09 13:39:18,064 - INFO - \u2713 Successfully created view: scr_val_ref
2025-12-09 13:39:19,508 - INFO - \u2713 Successfully created view: srvy_anvrsry_vlntr_questions
2025-12-09 13:39:20,889 - INFO - \u2713 Successfully created view: srvy_anvrsry_vlntr_questn_2_srvy_xref
2025-12-09 13:39:22,272 - INFO - \u2713 Successfully created view: srvy_anvrsry_vlntr_rspns_norm
2025-12-09 13:39:23,722 - INFO - \u2713 Successfully created view: srvy_anvrsry_vlntr_rspns_txt_norm
2025-12-09 13:39:25,150 - INFO - \u2713 Successfully created view: srvy_anvrsry_vlntr_survey
2025-12-09 13:39:26,567 - INFO - \u2713 Successfully created view: srvy_anvrsry_vlntr_values
2025-12-09 13:39:27,946 - INFO - \u2713 Successfully created view: srvy_anvrsy_vlntr_rspns
2025-12-09 13:39:29,444 - INFO - \u2713 Successfully created view: srvy_anvrsy_vlntr_rspns_all
2025-12-09 13:39:30,850 - INFO - \u2713 Successfully created view: srvy_blood_sponsor
2025-12-09 13:39:32,346 - INFO - \u2713 Successfully created view: srvy_blood_sponsor_questn_2_srvy_xref
2025-12-09 13:39:33,723 - INFO - \u2713 Successfully created view: srvy_blood_sponsor_rspns
2025-12-09 13:39:35,113 - INFO - \u2713 Successfully created view: srvy_blood_sponsor_survey
2025-12-09 13:39:36,479 - INFO - \u2713 Successfully created view: srvy_blood_sponsor_values
2025-12-09 13:39:38,218 - INFO - \u2713 Successfully created view: srvy_gplg_rspns_ss
2025-12-09 13:39:39,658 - INFO - \u2713 Successfully created view: srvy_hsptl_customer_contact
2025-12-09 13:39:41,026 - INFO - \u2713 Successfully created view: srvy_hsptl_periods_hst
2025-12-09 13:39:42,491 - INFO - \u2713 Successfully created view: srvy_hsptl_questions
2025-12-09 13:39:43,881 - INFO - \u2713 Successfully created view: srvy_hsptl_questions_hst
2025-12-09 13:39:45,251 - INFO - \u2713 Successfully created view: srvy_hsptl_questn_2_srvy_xref
2025-12-09 13:39:46,646 - INFO - \u2713 Successfully created view: srvy_hsptl_questn_catgry
2025-12-09 13:39:48,013 - INFO - \u2713 Successfully created view: srvy_hsptl_respondents
2025-12-09 13:39:49,485 - INFO - \u2713 Successfully created view: srvy_hsptl_respondents_hst
2025-12-09 13:39:50,866 - INFO - \u2713 Successfully created view: srvy_hsptl_rspns
2025-12-09 13:39:52,233 - INFO - \u2713 Successfully created view: srvy_hsptl_rspns_hst
2025-12-09 13:39:53,622 - INFO - \u2713 Successfully created view: srvy_hsptl_rspns_txt
2025-12-09 13:39:54,991 - INFO - \u2713 Successfully created view: srvy_hsptl_sf_contact
2025-12-09 13:39:56,360 - INFO - \u2713 Successfully created view: srvy_hsptl_survey
2025-12-09 13:39:57,742 - INFO - \u2713 Successfully created view: srvy_hsptl_survey_hst
2025-12-09 13:39:59,108 - INFO - \u2713 Successfully created view: srvy_hsptl_values
2025-12-09 13:40:00,520 - INFO - \u2713 Successfully created view: srvy_hsptl_values_hst
2025-12-09 13:40:01,595 - WARNING - \u2717 Failed to create view: srvy_new_vlntr_los - Error Type: SYNTAX_ERROR
2025-12-09 13:40:03,033 - INFO - \u2713 Successfully created view: srvy_new_vlntr_questions
2025-12-09 13:40:03,041 - INFO - Progress: 300/317 views processed
2025-12-09 13:40:04,399 - INFO - \u2713 Successfully created view: srvy_new_vlntr_questn_2_srvy_xref
2025-12-09 13:40:05,799 - INFO - \u2713 Successfully created view: srvy_new_vlntr_rspns_norm
2025-12-09 13:40:07,187 - INFO - \u2713 Successfully created view: srvy_new_vlntr_rspns_txt_norm
2025-12-09 13:40:08,766 - INFO - \u2713 Successfully created view: srvy_new_vlntr_survey
2025-12-09 13:40:10,170 - INFO - \u2713 Successfully created view: srvy_new_vlntr_values
2025-12-09 13:40:11,600 - INFO - \u2713 Successfully created view: srvy_vlntr_anvrsry_los
2025-12-09 13:40:12,994 - INFO - \u2713 Successfully created view: srvy_vlntr_geogrphy_taxo
2025-12-09 13:40:14,058 - WARNING - \u2717 Failed to create view: srvy_vlntr_los - Error Type: SYNTAX_ERROR
2025-12-09 13:40:15,486 - INFO - \u2713 Successfully created view: suprsn_ts_cnst
2025-12-09 13:40:16,548 - WARNING - \u2717 Failed to create view: suprsn_ts_cnst_test - Error Type: SYNTAX_ERROR
2025-12-09 13:40:17,617 - WARNING - \u2717 Failed to create view: suspect_domains - Error Type: OTHER_ERROR
2025-12-09 13:40:18,677 - WARNING - \u2717 Failed to create view: total_allusers_storedprocslist - Error Type: OTHER_ERROR
2025-12-09 13:40:19,738 - WARNING - \u2717 Failed to create view: total_allusers_tblvwslist - Error Type: OTHER_ERROR
2025-12-09 13:40:20,808 - WARNING - \u2717 Failed to create view: total_svcacct_tblvwslist - Error Type: OTHER_ERROR
2025-12-09 13:40:21,881 - WARNING - \u2717 Failed to create view: vaidity_email_valdtn - Error Type: OTHER_ERROR
2025-12-09 13:40:23,286 - INFO - \u2713 Successfully created view: vcn_smry_intake
2025-12-09 13:40:24,903 - INFO - \u2713 Successfully created view: vms_sta_indivs
2025-12-09 13:40:26,315 - INFO - \u2713 Successfully created view: vms_sta_orgs
2025-12-09 13:40:26,322 - INFO - ================================================================================
2025-12-09 13:40:26,323 - INFO - EXECUTION SUMMARY
2025-12-09 13:40:26,323 - INFO - ================================================================================
2025-12-09 13:40:26,323 - INFO - Object Type: VIEW
2025-12-09 13:40:26,323 - INFO - Schema: mktg_ops_vws
2025-12-09 13:40:26,323 - INFO - Total Objects: 317
2025-12-09 13:40:26,323 - INFO - Successfully Created: 242
2025-12-09 13:40:26,323 - INFO - Failed: 75
2025-12-09 13:40:26,323 - INFO - Success Rate: 76.34%
2025-12-09 13:40:26,323 - INFO - Created objects saved to: D:\fetch_ddl_from_rs\Create_DDL_Output\ddl_output\mktg_ops_vws_views_20251209_133321_created.csv
2025-12-09 13:40:26,323 - INFO - Errored objects saved to: D:\fetch_ddl_from_rs\Create_DDL_Output\ddl_output\mktg_ops_vws_views_20251209_133321_errored.csv
2025-12-09 13:40:26,323 - INFO - ================================================================================
2025-12-09 13:40:26,326 - INFO - Connection closed. Script execution completed.
